,title,url,domain,snippet_description
Highly integrated electronic 3D devices With the help of LPKF Laser  Electronics AGs laser direct structuring a leading process in molded interconnect device  ,3D-MID Technology with Laser Direct Structuring (LDS) - LPKF,https://www.lpkf.com/en/industries-technologies/electronics-manufacturing/3d-mids-with-laser-direct-structuring-lds,www.lpkf.com,['Highly integrated electronic 3D devices With the help of LPKF Laser  Electronics AGs laser direct structuring a leading process in molded interconnect device \xa0']
Jan 24 2014  Molded interconnect devices MIDs are 3dimensional electromechanical parts  The appeal of a device such as the MID is easily recognized,What are molded interconnect devices? - EDN,https://www.edn.com/design/pc-board/4427506/What-are-molded-interconnect-devices-,www.edn.com,['Jan 24 2014  Molded interconnect devices MIDs are 3dimensional electromechanical parts  The appeal of a device such as the MID is easily recognized']
LPKF Laser Direct Structuring LDS Molded Interconnect Devices MID,Molded Interconnect Devices - LPKF Laser & Electronics,https://www.lpkfusa.com/products/mid/,www.lpkfusa.com,['LPKF Laser Direct Structuring LDS Molded Interconnect Devices MID']
Molded interconnect devices MIDs and laser direct structuring LDS  for MID solutions to include other electronics and components like antennas and sensor ,MID / LDS Technology – Molex,https://www.molex.com/molex/capabilities/mid__lds_technology,www.molex.com,['Molded interconnect devices MIDs and laser direct structuring LDS  for MID solutions to include other electronics and components like antennas and sensor\xa0']
Molex combines advanced MID technology with LDS antenna expertise to deliver  Molex has developed an innovative Molded Interconnect DeviceLaser Direct  applications that meet required medicalgrade electronic device guidelines,MediSpec MID/LDS Capabilities - Molex,https://www.molex.com/molex/products/family/medispec_midlds_capabilities,www.molex.com,['Molex combines advanced MID technology with LDS antenna expertise to deliver  Molex has developed an innovative Molded Interconnect DeviceLaser Direct  applications that meet required medicalgrade electronic device guidelines']
Aug 31 2018  LDS allows to eliminate components in electronic devices such as antennae in smartphones thus reducing assembly time and device production ,Molded Interconnect Device - Markets and Markets,https://www.marketsandmarkets.com/PressReleases/molded-interconnect-device.asp,www.marketsandmarkets.com,['Aug 31 2018  LDS allows to eliminate components in electronic devices such as antennae in smartphones thus reducing assembly time and device production\xa0']
Rising demand for miniaturization in consumer electronics industry to fuel MID market growth There is growing demand for todays portable electronic devices ,Molded Interconnect Device MID Market - Markets and Markets,https://www.marketsandmarkets.com/Market-Reports/molded-interconnect-device-market-150539319.html,www.marketsandmarkets.com,['Rising demand for miniaturization in consumer electronics industry to fuel MID market growth There is growing demand for todays portable electronic devices\xa0']
TE Connectivity TE is a global leader in MID Molded Interconnect Devices technology  MID offers stateoftheart custom designs for consumer electronics ,mid technology - TE Connectivity,https://www.te.com/commerce/DocumentDelivery/DDEController?Action=srchrtrv&DocNm=8-1773449-1&DocType=DS&DocLang=EN,www.te.com,['TE Connectivity TE is a global leader in MID Molded Interconnect Devices technology  MID offers stateoftheart custom designs for consumer electronics\xa0']
Design tracks on a 3Dbody Molded Interconnect Device MID  only need something to hold and connect your electronics components think about an MID,Molded Interconnect Device (MID) - TARGET 3001! PCB ...,https://server.ibfriedrich.com/wiki/ibfwikien/index.php?title=Molded_Interconnect_Device_(MID),server.ibfriedrich.com,['Design tracks on a 3Dbody Molded Interconnect Device MID  only need something to hold and connect your electronics components think about an MID']
